[
  {"IdOF": "OF001", "IdCommande": "CMD501", "Date_Planification": "2026-02-05", "Date_lancement": "2026-02-10"},
  {"IdOF": "OF002", "IdCommande": "CMD502", "Date_Planification": "2026-02-07", "Date_lancement": "2026-02-12"},
  {"IdOF": "OF003", "IdCommande": "CMD503", "Date_Planification": "2026-02-10", "Date_lancement": "2026-02-15"},
  {"IdOF": "OF004", "IdCommande": "CMD504", "Date_Planification": "2026-02-12", "Date_lancement": "2026-02-17"}
]

